{
  "$schema": "http://json-schema.org/draft-04/schema#",
  "type": "object",
  "properties": {
    "id": {
      "type": "string"
    },
    "me": {
      "type": "object",
      "properties": {
        "name": {
          "type": "string"
        },
        "address": {
          "type": "string"
        },
        "phone": {
          "type": "string"
        },
        "email": {
          "type": "string"
        },
        "website": {
          "type": "string"
        }
      },
      "required": ["name", "address", "phone", "email", "website"]
    },
    "recipient": {
      "type": "object",
      "properties": {
        "name": {
          "type": "string"
        },
        "address": {
          "type": "string"
        }
      },
      "required": ["name", "address"]
    },
    "fromDate": {
      "type": "string"
    },
    "toDate": {
      "type": "string"
    },
    "issueDate": {
      "type": "string"
    },
    "items": {
      "type": "array",
      "minItems": 1,
      "items": {
        "type": "object",
        "properties": {
          "name": {
            "type": "string"
          },
          "hours": {
            "type": "number"
          }
        },
        "required": ["name", "hours"]
      }
    },
    "pricePerHour": {
      "type": "integer"
    },
    "bankInformations": {
      "type": "string"
    }
  },
  "required": ["id", "me", "recipient", "fromDate", "toDate", "issueDate", "items", "pricePerHour", "bankInformations"]
}
